{
  "semgraph": "calendarAverage",
  "metric": "creditLeads",
  "measureType": "additive",
  "locale": "nl-BE",
  "context": {
    "domain": "Leads",
    "dataset": "creditLeads",
    "reliability": "voorbeelddata"
  },
  "title": "Kredietleads per dag, per maand (voorbeelddata)",
  "unit": "month",
  "horizon": 12,
  "data": [
    { "day": "2025-10-01", "value": 46 },
    { "day": "2025-10-02", "value": 44 },
    { "day": "2025-10-03", "value": 50 },
    { "day": "2025-10-04", "value": 35 },
    { "day": "2025-10-05", "value": 19 },
    { "day": "2025-10-06", "value": 43 },
    { "day": "2025-10-07", "value": 51 },
    { "day": "2025-10-08", "value": 50 },
    { "day": "2025-10-09", "value": 49 },
    { "day": "2025-10-10", "value": 52 },
    { "day": "2025-10-11", "value": 24 },
    { "day": "2025-10-12", "value": 28 },
    { "day": "2025-10-13", "value": 47 },
    { "day": "2025-10-14", "value": 49 },
    { "day": "2025-10-15", "value": 52 },
    { "day": "2025-10-16", "value": 51 },
    { "day": "2025-10-17", "value": 49 },
    { "day": "2025-10-18", "value": 33 },
    { "day": "2025-10-19", "value": 29 },
    { "day": "2025-10-20", "value": 46 },
    { "day": "2025-10-21", "value": 46 },
    { "day": "2025-10-22", "value": 53 },
    { "day": "2025-10-23", "value": 47 },
    { "day": "2025-10-24", "value": 48 },
    { "day": "2025-10-25", "value": 27 },
    { "day": "2025-10-26", "value": 19 },
    { "day": "2025-10-27", "value": 48 },
    { "day": "2025-10-28", "value": 43 },
    { "day": "2025-10-29", "value": 46 },
    { "day": "2025-10-30", "value": 46 },
    { "day": "2025-10-31", "value": 47 },
    { "day": "2025-11-01", "value": 26 },
    { "day": "2025-11-02", "value": 25 },
    { "day": "2025-11-03", "value": 50 },
    { "day": "2025-11-04", "value": 46 },
    { "day": "2025-11-05", "value": 49 },
    { "day": "2025-11-06", "value": 47 },
    { "day": "2025-11-07", "value": 46 },
    { "day": "2025-11-08", "value": 29 },
    { "day": "2025-11-09", "value": 26 },
    { "day": "2025-11-10", "value": 45 },
    { "day": "2025-11-11", "value": 43 },
    { "day": "2025-11-12", "value": 50 },
    { "day": "2025-11-13", "value": 49 },
    { "day": "2025-11-14", "value": 45 },
    { "day": "2025-11-15", "value": 25 },
    { "day": "2025-11-16", "value": 26 },
    { "day": "2025-11-17", "value": 47 },
    { "day": "2025-11-18", "value": 45 },
    { "day": "2025-11-19", "value": 48 },
    { "day": "2025-11-20", "value": 48 },
    { "day": "2025-11-21", "value": 53 },
    { "day": "2025-11-22", "value": 25 },
    { "day": "2025-11-23", "value": 26 },
    { "day": "2025-11-24", "value": 48 },
    { "day": "2025-11-25", "value": 46 },
    { "day": "2025-11-26", "value": 48 },
    { "day": "2025-11-27", "value": 44 },
    { "day": "2025-11-28", "value": 52 },
    { "day": "2025-11-29", "value": 24 },
    { "day": "2025-11-30", "value": 18 },
    { "day": "2025-12-01", "value": 40 },
    { "day": "2025-12-02", "value": 39 },
    { "day": "2025-12-03", "value": 39 },
    { "day": "2025-12-04", "value": 38 },
    { "day": "2025-12-05", "value": 36 },
    { "day": "2025-12-06", "value": 19 },
    { "day": "2025-12-07", "value": 19 },
    { "day": "2025-12-08", "value": 40 },
    { "day": "2025-12-09", "value": 45 },
    { "day": "2025-12-10", "value": 42 },
    { "day": "2025-12-11", "value": 36 },
    { "day": "2025-12-12", "value": 41 },
    { "day": "2025-12-13", "value": 28 },
    { "day": "2025-12-14", "value": 16 },
    { "day": "2025-12-15", "value": 45 },
    { "day": "2025-12-16", "value": 36 },
    { "day": "2025-12-17", "value": 44 },
    { "day": "2025-12-18", "value": 35 },
    { "day": "2025-12-19", "value": 44 },
    { "day": "2025-12-20", "value": 19 },
    { "day": "2025-12-21", "value": 16 },
    { "day": "2025-12-22", "value": 45 },
    { "day": "2025-12-23", "value": 36 },
    { "day": "2025-12-24", "value": 39 },
    { "day": "2025-12-25", "value": 37 },
    { "day": "2025-12-26", "value": 40 },
    { "day": "2025-12-27", "value": 23 },
    { "day": "2025-12-28", "value": 22 },
    { "day": "2025-12-29", "value": 35 },
    { "day": "2025-12-30", "value": 45 },
    { "day": "2025-12-31", "value": 40 },
    { "day": "2026-01-01", "value": 54 },
    { "day": "2026-01-02", "value": 55 },
    { "day": "2026-01-03", "value": 26 },
    { "day": "2026-01-04", "value": 23 },
    { "day": "2026-01-05", "value": 49 },
    { "day": "2026-01-06", "value": 46 },
    { "day": "2026-01-07", "value": 54 },
    { "day": "2026-01-08", "value": 46 },
    { "day": "2026-01-09", "value": 44 },
    { "day": "2026-01-10", "value": 29 },
    { "day": "2026-01-11", "value": 25 },
    { "day": "2026-01-12", "value": 53 },
    { "day": "2026-01-13", "value": 50 },
    { "day": "2026-01-14", "value": 46 },
    { "day": "2026-01-15", "value": 46 },
    { "day": "2026-01-16", "value": 44 },
    { "day": "2026-01-17", "value": 34 },
    { "day": "2026-01-18", "value": 19 },
    { "day": "2026-01-19", "value": 49 },
    { "day": "2026-01-20", "value": 48 },
    { "day": "2026-01-21", "value": 46 },
    { "day": "2026-01-22", "value": 52 },
    { "day": "2026-01-23", "value": 46 },
    { "day": "2026-01-24", "value": 28 },
    { "day": "2026-01-25", "value": 25 },
    { "day": "2026-01-26", "value": 48 },
    { "day": "2026-01-27", "value": 53 },
    { "day": "2026-01-28", "value": 48 },
    { "day": "2026-01-29", "value": 45 },
    { "day": "2026-01-30", "value": 51 },
    { "day": "2026-01-31", "value": 25 },
    { "day": "2026-02-01", "value": 23 },
    { "day": "2026-02-02", "value": 51 },
    { "day": "2026-02-03", "value": 45 },
    { "day": "2026-02-04", "value": 49 },
    { "day": "2026-02-05", "value": 55 },
    { "day": "2026-02-06", "value": 46 },
    { "day": "2026-02-07", "value": 27 },
    { "day": "2026-02-08", "value": 26 },
    { "day": "2026-02-09", "value": 54 },
    { "day": "2026-02-10", "value": 49 },
    { "day": "2026-02-11", "value": 54 },
    { "day": "2026-02-12", "value": 44 },
    { "day": "2026-02-13", "value": 45 },
    { "day": "2026-02-14", "value": 26 },
    { "day": "2026-02-15", "value": 19 },
    { "day": "2026-02-16", "value": 49 },
    { "day": "2026-02-17", "value": 45 },
    { "day": "2026-02-18", "value": 51 },
    { "day": "2026-02-19", "value": 52 },
    { "day": "2026-02-20", "value": 53 },
    { "day": "2026-02-21", "value": 30 },
    { "day": "2026-02-22", "value": 19 },
    { "day": "2026-02-23", "value": 44 },
    { "day": "2026-02-24", "value": 52 },
    { "day": "2026-02-25", "value": 48 },
    { "day": "2026-02-26", "value": 48 },
    { "day": "2026-02-27", "value": 53 },
    { "day": "2026-02-28", "value": 26 },
    { "day": "2026-03-01", "value": 19 },
    { "day": "2026-03-02", "value": 48 },
    { "day": "2026-03-03", "value": 48 },
    { "day": "2026-03-04", "value": 51 },
    { "day": "2026-03-05", "value": 45 },
    { "day": "2026-03-06", "value": 45 },
    { "day": "2026-03-07", "value": 30 },
    { "day": "2026-03-08", "value": 23 },
    { "day": "2026-03-09", "value": 52 },
    { "day": "2026-03-10", "value": 53 },
    { "day": "2026-03-11", "value": 51 },
    { "day": "2026-03-12", "value": 51 },
    { "day": "2026-03-13", "value": 52 },
    { "day": "2026-03-14", "value": 27 },
    { "day": "2026-03-15", "value": 29 },
    { "day": "2026-03-16", "value": 52 },
    { "day": "2026-03-17", "value": 52 },
    { "day": "2026-03-18", "value": 49 },
    { "day": "2026-03-19", "value": 48 },
    { "day": "2026-03-20", "value": 45 },
    { "day": "2026-03-21", "value": 29 },
    { "day": "2026-03-22", "value": 20 },
    { "day": "2026-03-23", "value": 48 },
    { "day": "2026-03-24", "value": 48 },
    { "day": "2026-03-25", "value": 54 },
    { "day": "2026-03-26", "value": 50 },
    { "day": "2026-03-27", "value": 52 },
    { "day": "2026-03-28", "value": 36 },
    { "day": "2026-03-29", "value": 22 },
    { "day": "2026-03-30", "value": 48 },
    { "day": "2026-03-31", "value": 54 },
    { "day": "2026-04-01", "value": 54 },
    { "day": "2026-04-02", "value": 47 },
    { "day": "2026-04-03", "value": 44 },
    { "day": "2026-04-04", "value": 27 },
    { "day": "2026-04-05", "value": 26 },
    { "day": "2026-04-06", "value": 50 },
    { "day": "2026-04-07", "value": 46 },
    { "day": "2026-04-08", "value": 48 },
    { "day": "2026-04-09", "value": 52 },
    { "day": "2026-04-10", "value": 50 },
    { "day": "2026-04-11", "value": 34 },
    { "day": "2026-04-12", "value": 24 },
    { "day": "2026-04-13", "value": 52 },
    { "day": "2026-04-14", "value": 55 },
    { "day": "2026-04-15", "value": 50 },
    { "day": "2026-04-16", "value": 50 },
    { "day": "2026-04-17", "value": 49 },
    { "day": "2026-04-18", "value": 31 },
    { "day": "2026-04-19", "value": 27 },
    { "day": "2026-04-20", "value": 52 },
    { "day": "2026-04-21", "value": 51 },
    { "day": "2026-04-22", "value": 46 },
    { "day": "2026-04-23", "value": 48 },
    { "day": "2026-04-24", "value": 47 },
    { "day": "2026-04-25", "value": 27 },
    { "day": "2026-04-26", "value": 28 },
    { "day": "2026-04-27", "value": 47 },
    { "day": "2026-04-28", "value": 46 },
    { "day": "2026-04-29", "value": 55 },
    { "day": "2026-04-30", "value": 48 },
    { "day": "2026-05-01", "value": 56 },
    { "day": "2026-05-02", "value": 33 },
    { "day": "2026-05-03", "value": 24 },
    { "day": "2026-05-04", "value": 56 },
    { "day": "2026-05-05", "value": 45 },
    { "day": "2026-05-06", "value": 54 },
    { "day": "2026-05-07", "value": 50 },
    { "day": "2026-05-08", "value": 49 },
    { "day": "2026-05-09", "value": 28 },
    { "day": "2026-05-10", "value": 24 },
    { "day": "2026-05-11", "value": 56 },
    { "day": "2026-05-12", "value": 51 },
    { "day": "2026-05-13", "value": 49 },
    { "day": "2026-05-14", "value": 47 },
    { "day": "2026-05-15", "value": 45 },
    { "day": "2026-05-16", "value": 25 },
    { "day": "2026-05-17", "value": 19 },
    { "day": "2026-05-18", "value": 49 },